{
  "schema_version": "0.1.0",
  "corte": "2026-10-29",
  "zona_horaria": "America/Lima",
  "cobertura": "inventario_inicial_no_exhaustivo",
  "normas": [
    {
      "id": "ley-32069",
      "denominacion": "Ley 32069",
      "tipo": "ley",
      "jurisdiccion": "PE",
      "fecha_publicacion": "2024-06-24",
      "fecha_emision": null,
      "vigencia": {
        "desde": "2025-04-22",
        "hasta": null,
        "estado": "vigencia_parcial_verificada",
        "fundamento": "Inicio general; excepciones y cadena completa pendientes."
      },
      "procedimientos": [
        "ampliacion_consultores",
        "aumento_cmc",
        "inscripcion",
        "reinscripcion",
        "actualizacion_legal",
        "actualizacion_financiera",
        "reconsideracion"
      ],
      "relaciones": [],
      "fuentes": [
        {
          "url": "https://www.gob.pe/institucion/oece/colecciones/45029-ley-n-32069-ley-general-de-contrataciones-publicas-y-su-reglamento",
          "consultado_el": "2026-10-29",
          "metodo": "resultado_buscador_oficial"
        },
        {
          "url": "https://busquedas.elperuano.pe/api/visor_html/2391987-1",
          "consultado_el": "2026-10-29",
          "metodo": "texto_web_abierto"
        }
      ],
      "validacion": {
        "nivel": "vigencia_parcial_verificada",
        "nota": "Inicio general; excepciones y cadena completa pendientes. Archivo conservado; alcance y archivos complementarios en manifiesto-descargas-2026-10-29.json. Descarga no equivale a revisión jurídica.",
        "revision_humana": null,
        "apta_para_reglas": false
      },
      "archivo": {
        "ruta": "normativa/originales/2026-10-29/ley-32069-consolidada-2026-07-19.pdf",
        "sha256": "f14ffa37b824b8af03c0b97e0603839a786ed61c7ca07b1d300c9af928d133f7",
        "descargado": true
      },
      "pendientes": [
        "Cotejar texto y anexos descargados; completar instrumentos faltantes.",
        "Cerrar cadena temporal y revisión humana antes de activar reglas."
      ]
    },
    {
      "id": "ley-32103",
      "denominacion": "Ley 32103",
      "tipo": "ley",
      "jurisdiccion": "PE",
      "fecha_publicacion": null,
      "fecha_emision": null,
      "vigencia": {
        "desde": null,
        "hasta": null,
        "estado": "pendiente",
        "fundamento": "Modificatoria identificada en compendio; verificar texto, publicación y alcance."
      },
      "procedimientos": [
        "ampliacion_consultores",
        "aumento_cmc",
        "inscripcion",
        "reinscripcion",
        "actualizacion_legal",
        "actualizacion_financiera",
        "reconsideracion"
      ],
      "relaciones": [
        {
          "tipo": "modifica",
          "destino": "ley-32069",
          "disposiciones": [],
          "estado": "pendiente_delimitacion"
        }
      ],
      "fuentes": [
        {
          "url": "https://www.gob.pe/institucion/oece/colecciones/45029-ley-n-32069-ley-general-de-contrataciones-publicas-y-su-reglamento",
          "consultado_el": "2026-10-29",
          "metodo": "resultado_buscador_oficial"
        }
      ],
      "validacion": {
        "nivel": "pendiente",
        "nota": "Modificatoria identificada en compendio; verificar texto, publicación y alcance.",
        "revision_humana": null,
        "apta_para_reglas": false
      },
      "archivo": {
        "ruta": null,
        "sha256": null,
        "descargado": false
      },
      "pendientes": [
        "Obtener y cotejar original completo y anexos.",
        "Cerrar cadena temporal y revisión humana antes de activar reglas."
      ]
    },
    {
      "id": "ley-32187",
      "denominacion": "Ley 32187",
      "tipo": "ley",
      "jurisdiccion": "PE",
      "fecha_publicacion": null,
      "fecha_emision": null,
      "vigencia": {
        "desde": null,
        "hasta": null,
        "estado": "pendiente",
        "fundamento": "Verificar modificación de disposición de entrada en vigencia y demás efectos."
      },
      "procedimientos": [
        "ampliacion_consultores",
        "aumento_cmc",
        "inscripcion",
        "reinscripcion",
        "actualizacion_legal",
        "actualizacion_financiera",
        "reconsideracion"
      ],
      "relaciones": [
        {
          "tipo": "modifica",
          "destino": "ley-32069",
          "disposiciones": [],
          "estado": "pendiente_delimitacion"
        }
      ],
      "fuentes": [
        {
          "url": "https://www.gob.pe/institucion/oece/colecciones/45029-ley-n-32069-ley-general-de-contrataciones-publicas-y-su-reglamento",
          "consultado_el": "2026-10-29",
          "metodo": "resultado_buscador_oficial"
        }
      ],
      "validacion": {
        "nivel": "pendiente",
        "nota": "Verificar modificación de disposición de entrada en vigencia y demás efectos.",
        "revision_humana": null,
        "apta_para_reglas": false
      },
      "archivo": {
        "ruta": null,
        "sha256": null,
        "descargado": false
      },
      "pendientes": [
        "Obtener y cotejar original completo y anexos.",
        "Cerrar cadena temporal y revisión humana antes de activar reglas."
      ]
    },
    {
      "id": "ley-32515",
      "denominacion": "Ley 32515",
      "tipo": "ley",
      "jurisdiccion": "PE",
      "fecha_publicacion": null,
      "fecha_emision": null,
      "vigencia": {
        "desde": null,
        "hasta": null,
        "estado": "en_conflicto",
        "fundamento": "Compendio presenta fechas inconsistentes con año fiscal 2026; no adoptar fechas mostradas sin original."
      },
      "procedimientos": [
        "ampliacion_consultores",
        "aumento_cmc",
        "inscripcion",
        "reinscripcion",
        "actualizacion_legal",
        "actualizacion_financiera",
        "reconsideracion"
      ],
      "relaciones": [
        {
          "tipo": "modifica",
          "destino": "ley-32069",
          "disposiciones": [],
          "estado": "pendiente_delimitacion"
        }
      ],
      "fuentes": [
        {
          "url": "https://www.gob.pe/institucion/oece/colecciones/45029-ley-n-32069-ley-general-de-contrataciones-publicas-y-su-reglamento",
          "consultado_el": "2026-10-29",
          "metodo": "resultado_buscador_oficial"
        }
      ],
      "validacion": {
        "nivel": "en_conflicto",
        "nota": "Compendio presenta fechas inconsistentes con año fiscal 2026; no adoptar fechas mostradas sin original.",
        "revision_humana": null,
        "apta_para_reglas": false
      },
      "archivo": {
        "ruta": null,
        "sha256": null,
        "descargado": false
      },
      "pendientes": [
        "Obtener y cotejar original completo y anexos.",
        "Cerrar cadena temporal y revisión humana antes de activar reglas."
      ]
    },
    {
      "id": "dl-1715",
      "denominacion": "Decreto Legislativo 1715",
      "tipo": "decreto_legislativo",
      "jurisdiccion": "PE",
      "fecha_publicacion": "2026-02-04",
      "fecha_emision": null,
      "vigencia": {
        "desde": "2026-02-05",
        "hasta": null,
        "estado": "vigencia_parcial_verificada",
        "fundamento": "Compendio identifica cambio del art. 85.1 e); relevancia directa RNP pendiente."
      },
      "procedimientos": [],
      "relaciones": [
        {
          "tipo": "modifica",
          "destino": "ley-32069",
          "disposiciones": [],
          "estado": "pendiente_delimitacion"
        }
      ],
      "fuentes": [
        {
          "url": "https://www.gob.pe/institucion/oece/colecciones/45029-ley-n-32069-ley-general-de-contrataciones-publicas-y-su-reglamento",
          "consultado_el": "2026-10-29",
          "metodo": "resultado_buscador_oficial"
        }
      ],
      "validacion": {
        "nivel": "vigencia_parcial_verificada",
        "nota": "Compendio identifica cambio del art. 85.1 e); relevancia directa RNP pendiente.",
        "revision_humana": null,
        "apta_para_reglas": false
      },
      "archivo": {
        "ruta": null,
        "sha256": null,
        "descargado": false
      },
      "pendientes": [
        "Obtener y cotejar original completo y anexos.",
        "Cerrar cadena temporal y revisión humana antes de activar reglas."
      ]
    },
    {
      "id": "ley-32732",
      "denominacion": "Ley 32732",
      "tipo": "ley",
      "jurisdiccion": "PE",
      "fecha_publicacion": "2026-07-19",
      "fecha_emision": null,
      "vigencia": {
        "desde": null,
        "hasta": null,
        "estado": "condicionada",
        "fundamento": "Modificación de Ley 32069 sujeta a publicación de modificación reglamentaria (novena DCF). No se identificó y validó el acto habilitante aplicable."
      },
      "procedimientos": [
        "ampliacion_consultores",
        "aumento_cmc",
        "inscripcion",
        "reinscripcion",
        "actualizacion_legal",
        "actualizacion_financiera",
        "reconsideracion"
      ],
      "relaciones": [
        {
          "tipo": "modifica",
          "destino": "ley-32069",
          "disposiciones": [],
          "estado": "pendiente_delimitacion"
        }
      ],
      "fuentes": [
        {
          "url": "https://www.gob.pe/institucion/oece/colecciones/45029-ley-n-32069-ley-general-de-contrataciones-publicas-y-su-reglamento",
          "consultado_el": "2026-10-29",
          "metodo": "resultado_buscador_oficial"
        }
      ],
      "validacion": {
        "nivel": "condicionada",
        "nota": "Modificación de Ley 32069 sujeta a publicación de modificación reglamentaria (novena DCF). No se identificó y validó el acto habilitante aplicable. Archivo conservado; alcance y archivos complementarios en manifiesto-descargas-2026-10-29.json. Descarga no equivale a revisión jurídica.",
        "revision_humana": null,
        "apta_para_reglas": false
      },
      "archivo": {